intent;utterance
phone_plan.travel_plan_add;i'm going on a trip to  Kuala Lumpur  for  7  days
phone_plan.travel_plan_add;i'm going on a trip to  Kuala Lumpur  for  7  days
phone_plan.travel_plan_add;traveling to  mexico  and want to make sure i have coverage
faq.bill_reduction.bill_type;How could I obtain a lower bill every month?
faq.bill_reduction.bill_type;Is there a way I could have lower bill amount each month?
faq.bill_reduction.bill_type;Could you get my bill reduced?
faq.bill_reduction.bill_type;Need some help getting my bill reduced.
faq.bill_reduction.bill_type;Any Bill reduction options for my account?
faq.bill_reduction.bill_type;How could I potentially reduce my monthly bill?
faq.bill_reduction.bill_type;How could I possibly reduce my bill?
faq.bill_reduction.bill_type;What options do I have to reduce my bill?
faq.bill_reduction.bill_type; What are my options to reduce my bill?
faq.bill_reduction.bill_type; What bills can you investigate?
faq.bill_reduction.bill_type; Bill types?
faq.bill_reduction.bill_type;What are the bill types you can explore?
faq.bill_reduction.bill_type;What are the main  bill  types you can look over for us?
faq.bill_reduction.bill_type;Can you tell me the types of bills you can explore?
faq.bill_reduction.bill_type;Which types of bills can you help us to investigate?
faq.bill_reduction.bill_type;Which types of bills can you look over?
faq.bill_reduction.bill_type;What are the types of bills you can look over?
faq.bill_reduction.bill_type;Tell me about the bill types you can investigate.
faq.bill_reduction.bill_type;Tell me about the types of bills present.
faq.bill_reduction.bill_type;Please tell me about the types of bills you can help out with.
faq.bill_reduction.bill_type;Please tell me about the bill types you can investigate.
faq.bill_reduction.bill_type;Can you tell me about the bill types you can help out with?
faq.bill_reduction.bill_type;On what types of bills you can provide help on?
faq.bill_reduction.bill_type;Types of bills you can investigate.
faq.bill_reduction.bill_type;Can you tell me the types of bills you can investigate?
faq.bill_reduction.bill_type;What are the type of bills you can help me to investigate?
faq.bill_reduction.bill_type;What type of bills can you help me to investigate?
bill_reduction.paymentcharge_type;Is  this a monthly   recurring  charge?
bill_reduction.paymentcharge_type;How often is the billing applied?
bill_reduction.paymentcharge_type;How often will I be billed for this?
bill_reduction.paymentcharge_type;Is this a bimonthly charge?
bill_reduction.paymentcharge_type;Is it an annual charge or a monthly charge?
bill_reduction.paymentcharge_type;Is this a charge that is recurring every month?
bill_reduction.paymentcharge_type;How frequently will this charge be applied?
bill_reduction.paymentcharge_type;Is there a cadence for this type of charge?
bill_reduction.paymentcharge_type;What is the frequency of this charge?
bill_reduction.paymentcharge_type;Is it yearly payment?
bill_reduction.paymentcharge_type;Is it  one time  payment for the subscription?
bill_reduction.paymentcharge_type;When is this subscription ending?
bill_reduction.paymentcharge_type;When will this be ending?
bill_reduction.paymentcharge_type;How long do I have to pay?
bill_reduction.paymentcharge_type;How many months is this commitment?
bill_reduction.paymentcharge_type;Will I be billed every time?
bill_reduction.paymentcharge_type;Does this happen every month?
bill_reduction.paymentcharge_type;Am I being charged every month?
bill_reduction.paymentcharge_type;Is it  recurrent  payment?
bill_reduction.paymentcharge_type;Will I be charged every month for this?
bill_reduction.paymentcharge_type;Is it a single time charge?
bill_reduction.paymentcharge_type;What type of payment charge is it?
bill_reduction.paymentcharge_type;Is that a  one time  charge?
bill_reduction.paymentcharge_type;is this a  one time ?
bill_reduction.paymentcharge_type;is  this  a  one time ?
bill_reduction.paymentcharge_type;is this a  recurring  charge?
bill_reduction.paymentcharge_type;what type of payment charge it is?
phone_plan.first_option;consider the  first option
phone_plan.first_option;I will take the  first option
phone_plan.first_option;the other  one
phone_plan.first_option;I'll take the  first one
phone_plan.unlimited_plans;can I switch to the un-limited data plan please
phone_plan.unlimited_plans;Can I be switched to unlimited data?
phone_plan.unlimited_plans;How can I switch to unlimited data plans.
phone_plan.unlimited_plans;want un-limited
phone_plan.unlimited_plans;" Can I be switched to unlimited data? "
phone_plan.unlimited_plans;switch to unlimited data
phone_plan.unlimited_plans;Guide me to switch my plan to unlimited.
phone_plan.unlimited_plans;It’s better to switch to unlimited for better options. Help me with it.
phone_plan.unlimited_plans;I feel like changing my plan type to unlimited. Can you help me with it?
phone_plan.unlimited_plans;How can I switch to un-limited plans.
phone_plan.unlimited_plans;Let me change to unlimited plans.
phone_plan.unlimited_plans;Change my subscription to unlimited plans.
phone_plan.unlimited_plans;I want to alter my subscription to an unlimited plan.
phone_plan.unlimited_plans;Transfer my subscription to unlimited plans.
phone_plan.unlimited_plans;Help me transfer my subscription to unlimited plans.
phone_plan.unlimited_plans;I want to transfer my subscription to unlimited plans.
phone_plan.unlimited_plans;Subscribe to unlimited plans
phone_plan.unlimited_plans;Switch to unlimited plans.
phone_plan.unlimited_plans;Please switch me to unlimited plans.
phone_plan.unlimited_plans;Help me switch to unlimited plans.
phone_plan.unlimited_plans;Let me be switched to unlimited plans.
phone_plan.unlimited_plans;Switch me to unlimited plans.
phone_plan.unlimited_plans;Can I be switched to unlimited plans?
phone_plan.unlimited_plans;Can you switch me to unlimited plans?
phone_plan.unlimited_plans;I want to switch to unlimited plans
phone_plan.unlimited_plans;what are my plan options
phone_plan.unlimited_plans;do you have any unlimited plans?
phone_plan.unlimited_plans;I need to switch to unlimited plans
phone_plan.unlimited_plans;want to switch to unlimited plans
troubleshoot.outage_issue;I think there is low wattage in our house.
troubleshoot.outage_issue;Please restore our electrical supply.
troubleshoot.outage_issue;We have no electricity here. What to do?
troubleshoot.outage_issue;There is loss of electrical power in our area.
troubleshoot.outage_issue;Is there a power cut in our area? If so, provide me the details.
troubleshoot.outage_issue;Can you provide me the details about the power cut in our area?
troubleshoot.outage_issue;It's been  eight hours  of outage here.
troubleshoot.outage_issue;It's very cool in here with no power.
troubleshoot.outage_issue;Please provide me with details about the power outage in our area.
troubleshoot.outage_issue;Details about the power outage in our area.
troubleshoot.outage_issue;Provide me details about the power cut in our area.
troubleshoot.outage_issue;Power cut in here.
troubleshoot.outage_issue;I want you to help me know about the power outage in our area.
troubleshoot.outage_issue;Can you help me with the power outage in our area?
troubleshoot.outage_issue;I think there is a power outage in our area.
troubleshoot.outage_issue;Power Outage here.
troubleshoot.outage_issue;Outage here
troubleshoot.outage_issue;Outage here. What to do?
troubleshoot.outage_issue;No power here.
troubleshoot.outage_issue;It's an outage in our area. What to do?
troubleshoot.outage_issue;It's power cut out here.
troubleshoot.outage_issue;There is no power in here.
troubleshoot.outage_issue;There is power  outage  in our area. What to do?
troubleshoot.outage_issue;There is  outage  in our area . what to do?
troubleshoot.outage_issue;There is  power cut  in our area. What to do?
phone_plan.upgrade_data;I’d like to have an upgrade for my data.
phone_plan.upgrade_data;I need a better data plan for my usage.
phone_plan.upgrade_data;What are the various data upgrade options?
phone_plan.upgrade_data;Could you please put me in a higher data plan?
phone_plan.upgrade_data;I need a better data plan for my needs. 
phone_plan.upgrade_data;Please put me in the higher data tier.
phone_plan.upgrade_data;I frequently run out of data. Is there an upgraded data plan that I could use?
phone_plan.upgrade_data;I need additional data. Could you upgrade it?
phone_plan.upgrade_data;Could you upgrade my date?
phone_plan.upgrade_data;Help me add more data to the existing data plan.
phone_plan.upgrade_data;Please add more data.
phone_plan.upgrade_data;Let the data plan be upgraded.
phone_plan.upgrade_data;Help me upgrade the data
phone_plan.upgrade_data;Please upgrade data
phone_plan.upgrade_data;Upgrade the plan.
phone_plan.upgrade_data;Upgrade my data plan
phone_plan.upgrade_data;This data plan does not meet my needs. Can I upgrade to a better one?
phone_plan.upgrade_data;I need a high volume of data.
phone_plan.upgrade_data;I want to have a sufficient data plan.
phone_plan.upgrade_data;The current data plan is not sufficient enough.
phone_plan.upgrade_data;I want more data.
phone_plan.upgrade_data;How to change my data plan?
phone_plan.upgrade_data;How can I upgrade my data plan to others?
phone_plan.upgrade_data;Can I upgrade my data plan
phone_plan.upgrade_data;need to upgrade my data plan
phone_plan.upgrade_data;I want to upgrade in data usage
phone_plan.upgrade_data;upgrade my data
phone_plan.upgrade_data;I want to upgrade my data usage
troubleshoot.outage_timeline;How long will it take?
troubleshoot.outage_timeline;How much time do I have to wait?
troubleshoot.outage_timeline;When will it return?
troubleshoot.outage_timeline;ETA for power to be back.
troubleshoot.outage_timeline;How long does it take?
troubleshoot.outage_timeline;When will it be back?
troubleshoot.outage_timeline;At what time can the power be back?
troubleshoot.outage_timeline;Can you tell me the estimated time for the power to be restored?
troubleshoot.outage_timeline;When will the power be back?
troubleshoot.outage_timeline;Will the power be back soon?
troubleshoot.outage_timeline;Please let me know the duration of the outage.
troubleshoot.outage_timeline;Tell me when the power is returning.
troubleshoot.outage_timeline;Please tell me ETA .
troubleshoot.outage_timeline;How long do I have to wait for the service to return?
troubleshoot.outage_timeline;How long does that take?
troubleshoot.outage_timeline;How long will it take for the service to be returned?
troubleshoot.outage_timeline;Can the service be restored by the evening?
troubleshoot.outage_timeline;What is the approximate time for the service to restore?
troubleshoot.outage_timeline;Will the service be back in  2  hours?
troubleshoot.outage_timeline;What is the ETA for getting the service back?
troubleshoot.outage_timeline;Can you tell me the approximate time for service to return to normalcy?
troubleshoot.outage_timeline;For how long do I need to wait for service to return?
troubleshoot.outage_timeline;How much time is it going to take?
troubleshoot.outage_timeline;How long do I have to wait?
troubleshoot.outage_timeline;How long is it going to take?
troubleshoot.outage_timeline;Do you know how long it's going to take?
faq.bill_reduction.current_bill;I just can’t figure out my bill.
faq.bill_reduction.current_bill;I want to understand my bill and I can’t seem to figure it out.
faq.bill_reduction.current_bill;Would you be kind enough to help me go through my current bill?
faq.bill_reduction.current_bill;Could you walk me through my current bill?
faq.bill_reduction.current_bill;Would you be able to explain my bill to me?
faq.bill_reduction.current_bill;I don’t know how I’m currently billed.
faq.bill_reduction.current_bill;How do I understand my current bill?
faq.bill_reduction.current_bill;Please explain the typical items I see in my current bill.
faq.bill_reduction.current_bill;What are the usual entries in my current bill?
faq.bill_reduction.current_bill;I want to know the components of my existing bill.
faq.bill_reduction.current_bill;I need help understanding my current bill.
faq.bill_reduction.current_bill;I want to understand my current bill.
faq.bill_reduction.current_bill;Tell me my current phone bill.
faq.bill_reduction.current_bill;What is my current phone bill?
faq.bill_reduction.current_bill;Can you tell me what my phone bill is?
faq.bill_reduction.current_bill;How can you help me know my phone bill?
faq.bill_reduction.current_bill;Can I know my phone bill?
faq.bill_reduction.current_bill;I want to know my current phone bill.
faq.bill_reduction.current_bill;Please help me know my current phone bill.
faq.bill_reduction.current_bill;Please let me know my phone bill.
faq.bill_reduction.current_bill;Help me know my current phone bill.
faq.bill_reduction.current_bill;Can you tell me my phone  bill ?
faq.bill_reduction.current_bill;What is my phone  bill ?
faq.bill_reduction.current_bill;Let me know my current phone bill.
faq.bill_reduction.current_bill;Please tell me know my current phone bill.
faq.bill_reduction.current_bill;Can you tell me my current phone bill?
faq.bill_reduction.current_bill;What is my current bill?
troubleshoot.password_change;Password slipped out of my mind. Please change it.
troubleshoot.password_change;I failed to remember my password. Please help
troubleshoot.password_change;I want to change my router password.
troubleshoot.password_change;Forgot my password.
troubleshoot.password_change;Can you help me change my router password?
troubleshoot.password_change;Please change my password.
troubleshoot.password_change;I want to reset my password.
troubleshoot.password_change;Let me reset my password.
troubleshoot.password_change;"Too many people are using my wifi. Help me! Let me reset my password."
troubleshoot.password_change;Guide me the details to change my password.
troubleshoot.password_change;Reset my password.
troubleshoot.password_change;Help me change my password
troubleshoot.password_change;Change my password.
troubleshoot.password_change;I suspect some unauthorised logins. Are there any instructions to change the password?
troubleshoot.password_change;I want to change the default password. What's the procedure?
troubleshoot.password_change;How do I change the default password?
troubleshoot.password_change;Looks like my router is no longer accepting my password. How do I change it?
troubleshoot.password_change;What steps do I need to follow to reset my password?
troubleshoot.password_change;Please help me with the process of changing the password.
troubleshoot.password_change;Need help changing the admin password for my router.
troubleshoot.password_change;My password doesn't work. How do I reset it?
troubleshoot.password_change;I forgot my password. How do I change it?
troubleshoot.password_change;How do I reset my password?
troubleshoot.password_change;Can you please help me change my  wifi   password ?
troubleshoot.password_change;I want to change my  password
