intent;utterance
troubleshoot.router_issue;My internet stutters during my virtual meetings.
troubleshoot.router_issue;My WiFi signals are too weak. Please improve them.
troubleshoot.router_issue;I cannot send texts.
troubleshoot.router_issue;My WiFi isn't working and I've restarted my router many times.
troubleshoot.router_issue;Improve my WiFi speed.
troubleshoot.router_issue;I am not able to watch good quality videos.
troubleshoot.router_issue;My texts aren't going through. What to do?
troubleshoot.router_issue;I am having trouble listening to calls.
troubleshoot.router_issue;I am not able to receive calls.
troubleshoot.router_issue;I am not able to receive texts. What to do?
troubleshoot.router_issue;Wifi doesn't work.
troubleshoot.router_issue;I am facing challenges in connecting to the web.
troubleshoot.router_issue;The signal strength is weak.
troubleshoot.router_issue;I have a poor network.
troubleshoot.router_issue;I think my router is not working well.
troubleshoot.router_issue;I can not access the internet.
troubleshoot.router_issue;I seem to have issues connecting to the web.
troubleshoot.router_issue;I am having trouble connecting to the internet
troubleshoot.router_issue;My  router  is not working .
troubleshoot.router_issue;My WiFi is not working
troubleshoot.router_issue;My  internet  isn't working and I've restarted my  router  a couple of times.
phone_plan.other_options;I want another alternative.
phone_plan.other_options;Is there any other alternative?
phone_plan.other_options;Are there any alternatives available?
phone_plan.other_options;Please tell me the other options.
phone_plan.other_options;What are the other options?
phone_plan.other_options;Other Options?
phone_plan.other_options;Tell me about the other options.
phone_plan.other_options;Help me know about the other options.
phone_plan.other_options;Let me know the better options.
phone_plan.other_options;Can you tell me the other options?
phone_plan.other_options;I want a better option.
phone_plan.other_options;I would like you to search for other ways.
phone_plan.other_options;I want to get details of other options.
phone_plan.other_options;Are these the available options? Do I have any other?
phone_plan.other_options;Is there any better way?
phone_plan.other_options;Is there a better way?
phone_plan.other_options;Could you get me another option?
phone_plan.other_options;What other options do I have?
phone_plan.other_options;Is there a better option?
phone_plan.other_options;I did not like either of these options. Is there any other?
phone_plan.other_options;Are there other ways?
phone_plan.other_options;I would like to know other ways to reduce my bill.
phone_plan.other_options;Do you have any other choices?
phone_plan.other_options;Are there other options?
phone_plan.other_options;What other options are there?
phone_plan.other_options;can you show me other available options?
phone_plan.other_options;show me other options?
phone_plan.charge_type;Is  this a monthly   recurring  charge?
phone_plan.charge_type;How often is the billing applied?
phone_plan.charge_type;How often will I be billed for this?
phone_plan.charge_type;Is this a bimonthly charge?
phone_plan.charge_type;Is it an annual charge or a monthly charge?
phone_plan.charge_type;Is this a charge that is recurring every month?
phone_plan.charge_type;How frequently will this charge be applied?
phone_plan.charge_type;Is there a cadence for this type of charge?
phone_plan.charge_type;What is the frequency of this charge?
phone_plan.charge_type;Is it yearly payment?
phone_plan.charge_type;Is it one time payment for the subscription?
phone_plan.charge_type;When is this subscription ending?
phone_plan.charge_type;When will this be ending?
phone_plan.charge_type;How long do I have to pay?
phone_plan.charge_type;How many months is this commitment?
phone_plan.charge_type;Will I be billed every time?
phone_plan.charge_type;Does this happen every month?
phone_plan.charge_type;Am I being charged every month?
phone_plan.charge_type;Is it recurrent payment?
phone_plan.charge_type;Will I be charged every month for this?
phone_plan.charge_type;Is it a single time charge?
phone_plan.charge_type;What type of payment charge is it?
phone_plan.charge_type;Is that a one time charge?
phone_plan.charge_type;s this a one time?
phone_plan.charge_type;Is that a  $15  increase per month?
bill_reduction.unfamiliar_charge;I’m not acknowledged of doing any such purchases
bill_reduction.unfamiliar_charge;I’m not acknowledged of any such thing.
bill_reduction.unfamiliar_charge;I’m not aware of anything .
bill_reduction.unfamiliar_charge;I did not do any transactions.
bill_reduction.unfamiliar_charge;I have no knowledge of purchases.
bill_reduction.unfamiliar_charge;I guess there are no purchases made.
bill_reduction.unfamiliar_charge;No purchases made.
bill_reduction.unfamiliar_charge;I think i have not made any purchases.
bill_reduction.unfamiliar_charge;I did not make any transactions.
bill_reduction.unfamiliar_charge;I have no knowledge of it.
bill_reduction.unfamiliar_charge;I did not commit to it.
bill_reduction.unfamiliar_charge;I did not subscribe to it.
bill_reduction.unfamiliar_charge; I did not purchase it.
bill_reduction.unfamiliar_charge;This is strange
bill_reduction.unfamiliar_charge;It’s unfamiliar to me.
bill_reduction.unfamiliar_charge;I am not familiar with this.
bill_reduction.unfamiliar_charge;I have no idea of this transaction.
bill_reduction.unfamiliar_charge;I have no idea about it.
bill_reduction.unfamiliar_charge;I did not make that purchase.
bill_reduction.unfamiliar_charge;I don’t know if it is billed.
bill_reduction.unfamiliar_charge;I don’t know about those charges.
bill_reduction.unfamiliar_charge;I do not know about that.
bill_reduction.unfamiliar_charge;I did not buy it.
bill_reduction.unfamiliar_charge;I do not know that transaction.
bill_reduction.unfamiliar_charge;Is it? I haven’t made any purchases.
bill_reduction.unfamiliar_charge;I did not make that purchase
faq.support_bot;Are you a bot?
faq.support_bot;Are you a real person?
faq.support_bot;I would appreciate some help.
faq.support_bot;I badly need some help.
faq.support_bot;What are the areas where you could help?
faq.support_bot;How could you help me?
faq.support_bot;May I get some directions?
faq.support_bot;Could you please help me with the service?
faq.support_bot;Need help. I’m stuck :(
faq.support_bot;What info can I get from you?
faq.support_bot;I am looking for some help.
faq.support_bot;Can you help with my questions?
faq.support_bot;Wondering how you can help me
faq.support_bot;How can the bot help me?
faq.support_bot;What does the bot do?
faq.support_bot;what the virtual agent can do?
faq.support_bot;what the agent can do?
faq.support_bot;what the bot can do?
faq.support_bot;What would you like to do?
faq.support_bot;Why are you here?
faq.support_bot;What can you do for me?
faq.support_bot;What are you?
faq.support_bot;Who are you?
faq.support_bot;What type of chatbot are you?
faq.support_bot;What things do you do to help me?
faq.support_bot;What can you do to help me?
faq.support_bot;What do you do?
faq.support_bot;How do you work?
faq.support_bot;What can you do?
faq.support_bot;How can you help me?
phone_plan.new_number;Can you reveal my new number?
phone_plan.new_number;I'm excited to know my new number.
phone_plan.new_number;What's my number?
phone_plan.new_number;Would you mind telling me my new number?
phone_plan.new_number;New number
phone_plan.new_number;May I ask the number of my new line?
phone_plan.new_number;Tell me my new number please.
phone_plan.new_number;Let me know my new number.
phone_plan.new_number;How can I get the new line's number?
phone_plan.new_number;Which is the new line I got now?
phone_plan.new_number;What is the number of the line, which I just got?
phone_plan.new_number;Can I get the latest line's number?
phone_plan.new_number;Is it possible to know my new line's number?
phone_plan.new_number;Can I see the number please?
phone_plan.new_number;What is  this  new line's number?
phone_plan.new_number;I want to know my new device's number.
phone_plan.new_number;Could you give me my new line's contact number?
phone_plan.new_number;Show me my new number
phone_plan.new_number;What is my  current  number?
phone_plan.new_number;My updated number please
phone_plan.new_number;What is the latest number?
phone_plan.new_number;What is the updated number?
phone_plan.new_number;Can you tell me my new number now?
phone_plan.new_number;What is my new number?
phone_plan.general_plan_question;Please change my plan.
phone_plan.general_plan_question;Switch my plan.
phone_plan.general_plan_question;Alter my plan.
phone_plan.general_plan_question;Please help me change my plan.
phone_plan.general_plan_question;Can I be switched to a different plan?
phone_plan.general_plan_question;Guide me to change plans.
phone_plan.general_plan_question;Transfer my plan.
phone_plan.general_plan_question;Switch  plans.
phone_plan.general_plan_question;Let me change  plans.
phone_plan.general_plan_question;Change my plan.
phone_plan.general_plan_question;I want to alter my plan..
phone_plan.general_plan_question;Transfer my subscription.
phone_plan.general_plan_question;Help me transfer my subscription.
phone_plan.general_plan_question;I want to transfer my subscription .
phone_plan.general_plan_question;Subscribe to other plans.
phone_plan.general_plan_question;Switch to another plan.
phone_plan.general_plan_question;Please switch me to other plans.
phone_plan.general_plan_question;Help me switch to other plans.
phone_plan.general_plan_question;Let me be switched to another plan.
phone_plan.general_plan_question;Switch me to other plans.
phone_plan.general_plan_question;Can I be switched to another plan?
phone_plan.general_plan_question;Can you switch me to other plans?
phone_plan.general_plan_question;I want to switch to other plans
phone_plan.general_plan_question;thinking about a plan change
phone_plan.general_plan_question;change plan
bill_reduction.initiate;Why is my bill so high  this month ?
bill_reduction.initiate;My  TV  bill increased by  $15  and I can't seem to figure out why.
bill_reduction.initiate;I am trying to figure out why I was charged an extra  $25  in  the past month .
bill_reduction.initiate;Can you explain my recent bill? The charges seem rather unusual.
bill_reduction.initiate;There is some high fee added to my recent bill. What is it regarding?
bill_reduction.initiate;My current bill shows higher than normal charge. Can you resolve it?
bill_reduction.initiate;I’m shocked to see a high charge on my recent bill.
bill_reduction.initiate;My recent bill is 20% higher than the previous one.
bill_reduction.initiate;There seems to be some unauthorized charges on my account. Could you help?
bill_reduction.initiate;How can I cut-down my monthly bill?
bill_reduction.initiate;Are there any plans with less monthly charges/bills?
bill_reduction.initiate;Can I get a better plan?
bill_reduction.initiate;I want to decrease my monthly charges on the phone.
bill_reduction.initiate;I’ve been noticing extra charges to my account. Could you help me understand them?
bill_reduction.initiate;Could I get more details on this month’s mobile bill? It seems high.
bill_reduction.initiate;I don’t understand the reason for the high bill on my mobile this month.
bill_reduction.initiate;I wasn’t expecting a higher bill on my mobile this month.
bill_reduction.initiate;My mobile bill is higher than usual.
bill_reduction.initiate;I got my monthly bill and wondering why it is higher than usual.
bill_reduction.initiate;This month’s bill is more than last month’s.
bill_reduction.initiate;My last month’s bill is less than the current month’s bill.
bill_reduction.initiate;Why is my bill so high for the past few months?
bill_reduction.initiate;My TV bill increased by $15 and I can't seem to figure out why.
bill_reduction.initiate;Why is my bill so high for the month of february?
bill_reduction.initiate;Why is my recent bill so high?
bill_reduction.initiate;Why is my bill so high this month?
bill_reduction.initiate;Why is my bill so high?
bill_reduction.save_bill;Are there any  offers  running?
bill_reduction.save_bill;Are there any special  promotions  to help me reduce my monthly bill amount?
bill_reduction.save_bill;do you have any  discount  plans?
bill_reduction.save_bill;Are there any  discounts  or new plans I can take advantage of to lower my bill amount?
bill_reduction.save_bill;Do you have any  discount  plans for thanksgiving?
bill_reduction.save_bill;Are there any upcoming  promotions  for existing customers?
bill_reduction.save_bill;I've been a loyal customer for several years now. Can I get a  discount  starting the next billing cycle?
bill_reduction.save_bill;Do you have any  promotions  for christmas/ new year specifically for existing customers?
bill_reduction.save_bill;Is there any  deal  to reduce my bill?
bill_reduction.save_bill;Am I eligible for any  promotional  offer?
bill_reduction.save_bill;Can I get a better  discount  plan?
bill_reduction.save_bill;Are  Discount  plans available?
bill_reduction.save_bill;Discount  available?
bill_reduction.save_bill;Free  promotion  available?
bill_reduction.save_bill;Will the  discount  be given?
bill_reduction.save_bill;Can I avail the  discount  plan?
bill_reduction.save_bill;Please save money.
bill_reduction.save_bill;I have no money right now. Please reduce my bill.
bill_reduction.save_bill;What are the ways I can reduce my bill?
bill_reduction.save_bill;Lower my bill.
bill_reduction.save_bill;Save money on my bills.
bill_reduction.save_bill;Reduce my bill.
bill_reduction.save_bill;Let me know the best way to reduce my bills.
bill_reduction.save_bill;Help me in reducing my bills.
bill_reduction.save_bill;Can you help me in saving money on my bills?
bill_reduction.save_bill;Help me in saving money on my bills.
bill_reduction.save_bill;I want to cut down my monthly bill.
bill_reduction.save_bill;Please help me find a way to reduce my bill.
bill_reduction.save_bill;Is there a way to lower my bill?
bill_reduction.save_bill;I want to save money on my monthly plan.
bill_reduction.save_bill;My monthly bill is high. I want to reduce it.
bill_reduction.save_bill;How can I lower my bill?
bill_reduction.save_bill;I think I no longer need all the services. Can I reduce my bill by adjusting my service options?
bill_reduction.save_bill;I lost my job and can’t pay the full bill. Can you help  reduce the bill amount for some time?
bill_reduction.save_bill;I am financially impacted due to Covid. Is there a way I could reduce my bill for some time?
bill_reduction.save_bill;I wish to change my plan and get a lower bill each month?
bill_reduction.save_bill;Are there any best practices that help me reduce my bill?
bill_reduction.save_bill;Could you help me find ways to reduce my bill amount?
bill_reduction.save_bill;How do I reduce my bill amount?
bill_reduction.save_bill;What can I do to reduce my bill amount?
bill_reduction.save_bill;How can I save money on my Bill?
bill_reduction.save_bill;"How can I save money on my bill?"
faq.troubleshoot.service_type;Who can help me troubleshoot the problem with my service.
faq.troubleshoot.service_type;How do I troubleshoot the problem I have with my service?
faq.troubleshoot.service_type;Are you the right person to address any service related issues?
faq.troubleshoot.service_type;Please troubleshoot my service disruption.
faq.troubleshoot.service_type;Would you be able to help troubleshoot the service issue I am facing?
faq.troubleshoot.service_type;Could you help me find the root-cause for the service issue I am having?
faq.troubleshoot.service_type;What is the root-cause for the issue I’m facing?
faq.troubleshoot.service_type;I’m trying to troubleshoot an issue. Would you be able to help me?
faq.troubleshoot.service_type;I need some help troubleshooting an issue.
faq.troubleshoot.service_type;How to change the wifi settings?
faq.troubleshoot.service_type;What are the service types you can provide us?
faq.troubleshoot.service_type;What are the main service types you can provide  for us?
faq.troubleshoot.service_type;Can you tell me the types of services you provide?
faq.troubleshoot.service_type;Which types of services can you help us to troubleshoot?
faq.troubleshoot.service_type;What are the types of services you can look over?
faq.troubleshoot.service_type;Tell me about the service types you can troubleshoot.
faq.troubleshoot.service_type;Tell me about the types of services present.
faq.troubleshoot.service_type;Please tell me about the types of services you can help out with.
faq.troubleshoot.service_type;Please tell me about the service types you can troubleshoot.
faq.troubleshoot.service_type;Can you tell me about the service types you can help out with?
faq.troubleshoot.service_type;On what types of services you can provide help on?
faq.troubleshoot.service_type;Types of services you can troubleshoot.
faq.troubleshoot.service_type;Can you tell me the type of services you can troubleshoot?
faq.troubleshoot.service_type;What services are you troubleshooting right now?
faq.troubleshoot.service_type;What type of services can you troubleshoot?
bill_reduction.cheaper_plan_options;I need a  phone  plan that is more affordable. Please help.
bill_reduction.cheaper_plan_options;Any cheaper options that you could make me aware of?
bill_reduction.cheaper_plan_options;Do you have another cheaper plan for my phone?
bill_reduction.cheaper_plan_options;May I get a cheaper phone plan?
bill_reduction.cheaper_plan_options;How do I make sure my phone gets a reduced bill?
bill_reduction.cheaper_plan_options;I want reduced phone bills each month and I am looking.
bill_reduction.cheaper_plan_options;I want a plan that is cheaper since I don’t need all the services.
bill_reduction.cheaper_plan_options;This plan doesn’t suit my needs and it’s expensive. Do you have a cheaper plan?
bill_reduction.cheaper_plan_options;What other plans are available that are cheaper?
bill_reduction.cheaper_plan_options;Could you help me get a cheaper plan?
bill_reduction.cheaper_plan_options;I would like you to search for other plans with less monthly bill.
bill_reduction.cheaper_plan_options;I want to get details of other cheaper options.
bill_reduction.cheaper_plan_options;is  this  the cheaper plan you have?
bill_reduction.cheaper_plan_options;that is the cheapest plan you have?
bill_reduction.cheaper_plan_options;are there no cheaper plans than that?
bill_reduction.cheaper_plan_options;Are these the available options? Do I have anything cheaper?
bill_reduction.cheaper_plan_options;Could you get me a less expensive option?
bill_reduction.cheaper_plan_options;What other cheap options do I have?
bill_reduction.cheaper_plan_options;Is there a cheaper option?
bill_reduction.cheaper_plan_options;I did not like either of these options. Are there any other cheaper plans?
bill_reduction.cheaper_plan_options;Are there other cheap plans?
bill_reduction.cheaper_plan_options;Do you have any other cheaper choices?
bill_reduction.cheaper_plan_options;Are there other more affordable options?
bill_reduction.cheaper_plan_options;What are the other affordable plans?
bill_reduction.cheaper_plan_options;Are there any cheaper options?
bill_reduction.cheaper_plan_options;Is there anything cheaper?
bill_reduction.cheaper_plan_options;Do you have anything more affordable?
bill_reduction.cheaper_plan_options;I am wondering if I could reduce my monthly bill amount by getting into a different plan.
bill_reduction.cheaper_plan_options;How to get a cheaper monthly bill?
troubleshoot.router_placement;What is the best place to place a router at home?
troubleshoot.router_placement;How is the router placed?
troubleshoot.router_placement;Can the router be placed anywhere in the house?
troubleshoot.router_placement;Where can be the WiFi router located?
troubleshoot.router_placement;What is the best location for a router?
troubleshoot.router_placement;Where to place a router for optimum signals?
troubleshoot.router_placement;How to place a router for optimum signals?
troubleshoot.router_placement;How can I place my router for better signals?
troubleshoot.router_placement;Where do I place my router for best placement?
troubleshoot.router_placement;Router placement.
troubleshoot.router_placement;Do you know the optimum router placement?
troubleshoot.router_placement;Where can I place my modem?
troubleshoot.router_placement;Help me place the router so that I get maximum signal strength.
troubleshoot.router_placement;Help me with my router placement.
troubleshoot.router_placement;Tell me a place where my WiFi has less interference with other signals.
troubleshoot.router_placement;Suggest me a place to keep my router where I can get a maximum amount of signals.
troubleshoot.router_placement;Let me know the best place for my modem placement.
troubleshoot.router_placement;Please let me know the best place for my router placement.
troubleshoot.router_placement;Tell me the best place for my modem placement.
troubleshoot.router_placement;Tell me the best place for my router placement.
troubleshoot.router_placement;Can you tell me the better place to place my router?
troubleshoot.router_placement;Where can I place my router?
troubleshoot.router_placement;Where do I place my router?
troubleshoot.router_placement;Can you help me with my router placement?
troubleshoot.router_placement;I want to know my optimum router placement
phone_plan.travel_plan_add;We will be leaving for  London   next week .
phone_plan.travel_plan_add;will be leaving for  spain   next week
phone_plan.travel_plan_add;can I use internet and make calls while I am abroad?
phone_plan.travel_plan_add;Going over seas and need a travel plan
phone_plan.travel_plan_add;I need help for a trip I'm taking soon.
phone_plan.travel_plan_add;Is there an international traveling package for my phone?
phone_plan.travel_plan_add;I want the ability to send text messages while traveling internationally.
phone_plan.travel_plan_add;Can I get international roaming enabled for my phone?
phone_plan.travel_plan_add;Can you add international roaming service for my phone?
phone_plan.travel_plan_add;How do I avoid roaming fees while using my phone in a different country?
phone_plan.travel_plan_add;Should I get a new phoen plan while going abroad?
phone_plan.travel_plan_add;Please ensure my phone works in  South Africa  from 11th to 22nd of this month.
phone_plan.travel_plan_add;Can you expand my coverage to countries outside the  US  for about  9  days?
phone_plan.travel_plan_add;I want international day pass on my phone for the next  7  days.
phone_plan.travel_plan_add;I want travel pass for the next  10  days.
phone_plan.travel_plan_add;Is my phone capable of working with networks in other countries?
phone_plan.travel_plan_add;Can I make phone calls while traveling internationally?
phone_plan.travel_plan_add;Will internet on my phone work while I am traveling abroad?
phone_plan.travel_plan_add;I will be visting my parents in  Sri Lanka  for the next two weeks. Could you enable travel pass to my phone?
phone_plan.travel_plan_add;How do I add some type ofan international plan to my phone?
phone_plan.travel_plan_add;Can I use my data while traveling internationally?
phone_plan.travel_plan_add;I am traveling internationally. How do I make use of my current phone instead of buying a new phone and/or a local SIM card?
phone_plan.travel_plan_add;I am going to  Israel  on a study tour. I want my phone to work in the local telecom network.
phone_plan.travel_plan_add;I am going to  Dubai  on a business tour. Please enable travel plan to my phone.
phone_plan.travel_plan_add;I will be in India for the next  3  weeks. Can I make my phone work with Reliance network?
phone_plan.travel_plan_add;How do I make my current phone work in a differen country?
phone_plan.travel_plan_add;I will be in Canada next week and will be back the following week. Will my phone work in  Canada ?
phone_plan.travel_plan_add;I am planning for a hitchhiking tour in  Asia  and  Europe . Any tips to remain in contact with my parents using my existing phone?
phone_plan.travel_plan_add;We are going on a honeymoon trip to  New Zealand . Can we have some kind of an international phone plan?
phone_plan.travel_plan_add;I am going to  Africa  on a study trip. Would my current phone work there?
phone_plan.travel_plan_add;How do I get international travel pass on my phone line?
phone_plan.travel_plan_add;Can I use my existing phone during international travel?
phone_plan.travel_plan_add;I am going abroad on vacation. Can I use the remaining minutes in my phone while traveling?
phone_plan.travel_plan_add;I will be visiting my friend in  Japan  next month and I want travel plan for my phone during this period
phone_plan.travel_plan_add;I will be going on a family vacation to  Asia  for the next  3  weeks. Can I use my existing phone without taking a local SIM card?
phone_plan.travel_plan_add;I'm going on a business trip to  Europe . Can I get a travel pass added to my account?
phone_plan.travel_plan_add;going to be traveling and need to make sure my phone will work
phone_plan.travel_plan_add;going to be in  china  and need coverage for my phone
phone_plan.travel_plan_add;need a plan because I'll be in  India  for  3  days
phone_plan.travel_plan_add;traveling to mexico and want to make sure i have coverage
phone_plan.travel_plan_add;taking a flight to  Montreal  and I want to make sure data works when i land
